H1_leftside_heading,H1_rightside_heading,H2,H3,All_para,li,div,div_2
Google Sheets ,MIN Function,"MIN Function,Min Function Example",,"The , function is a premade function in Google Sheets, which finds the lowest number in a range.,It is typed , and gets a list of cells:,You can ,Let's have a look at an example!,Find the lowest total stats in the range ,:,Now, the function returns the lowest value from the cells in the range:, The function has successfully found the lowest value, ,. Magikarp has the lowest Total stats of the Pokemons in this list.,Let's add text to a cell in the range , to see what happens. Type Kadabra into the cell ,:, The function ignores the text typed in the range. , is returned as the new lowest value, as the old one was replaced with text. Rattata is now the Pokemon with the lowest Total stats in the range ,.",,,
Google Sheets IFS Function,,"IFS Function,Example IFS function",,"The , function is a premade function in Google Sheets, which returns values based on one or more , or , ,.,It is typed , and has two or more parts:,The , are referred to as ,, which can check things like:,Each condition is connected with a return value.,Make categories for how fast the Pokemon are:,The conditions and return values are:,Example , function, step by step:,Since the value in cell , is ""45"", the first and second conditions are ,, and third condition is , (less than or equal to 50), the function will return ""Slow"".,The function can be repeated with the , for each row to perform the same check for each Pokemon:,Now, each Pokemon has a speed category:","If a number is , another number ,If a number is , another number ,If a number or text is , to something ,Speed , 90: ""Fast"",Speed , 50: ""Normal"",Speed , 50: ""Slow""",,
Google Sheets ,MEDIAN Function,"MEDIAN Function,Median Function Example",,"The , function is a premade function in Google Sheets, which returns the middle value in the data.,It is typed , and gets a list of cells:,You can ,Calculating the median manually requires that the data is sorted and arranged from low to high. This is not necessary using the MEDIAN function, it does it for you.,Find the median of this list of numbers ,:, function, step by step:,Now, the function returns the median:, You successfully found the median using the , function.,Note that it found the value in the middle of the data, which is cell ,, the one that is marked red:",,,
Google Sheets ,MODE Function,"MODE Function,Mode Function Example (SNGL),Mode Function Example (MULT)",,"The , function is a premade function in Google Sheets, which is used to find the most common value(s).,There are two versions, which are typed , or , that gets a list of cells:,You can , does the same as , and returns , (picking the first it finds)., returns multiple values if there are more than one that is the most common.,Let's have a look at some examples!,Find the most common number of all the different Pokeballs in the trainers' inventories. ,The , function, step by step:,Now, the function returns the most common value in the range:,It returns the number , which is seen 7 times. The closest number to it is , and , which are seen 3 times each.,Find the most common number of Pokeballs in the trainers' inventories. ,The , function, step by step:,Now, the function returns the most common , in the range:,It returns the number , in the first cell (,) and the number , in the second cell (,). Both 10 and 12 are seen twice, which is more than any of the other values.",,,
Google Sheets ,STDEV.P Function,"STDEV.P Function,Stdev.p Function Example",,"The , function is a premade function in Google Sheets, which calculates the , for the entire population.,It is typed , and gets a list of cells:,You can ,The STDEV.P function ignores cells that do not contain numbers. ,Let's have a look at an example!,Find the standard deviation of the total stats for all of the Pokemon in the population:,The , function, step by step:,Now, the function returns the standard deviation of all the Total stat values:,The , function has successfully returned the , for the whole population as ,.",,,
Google Sheets OR Function,,"OR Function,Example OR Function,Example OR Function (with IF)",,"The , function is a premade function in Google Sheets, which returns , or , based on two or more ,.,It is typed ,.,The , are referred to as ,, ,, and so on.,The conditions can check things like:,Check if the Pokemon type is water , has defense , 60:,The function returns ""TRUE"" or ""FALSE"".,Example , function, step by step:,Since the value in cell , is not ""Water"" the first condition is ,.,Since the value in cell , is less than 60 the second condition is also ,., condition need to be , for the OR function to return ,.,The function can be repeated with the , for each row to perform the same check for each Pokemon:,Now, each row has a check for Water Type , Defense greater than 60:,For example:,Combining the OR function with an , lets you check , conditions for the IF function:,The IF function is typed , and has 3 parts:,The OR function takes the place of the , condition.,Here, the , function returns ""Yes"" or ""No"".,Example , function as the condition for , function, step by step:,The function can be repeated with the , for each row to perform the same check for each Pokemon:,Now, each row has a check for Water Type , Defense greater than 60:,For example:","If a number is , another number ,If a number is , another number ,If a number or text is , to something ,Ivysaur is , Water type, but it has , than 60 defense, so the function returns ""TRUE"".,Charmeleon is , Water type, and has , than 60 defense, so the function returns ""FALSE"",Wartortle is , Water type and has , than 60 defense, so the function returns ""TRUE"" ,Ivysaur is , Water type, but it has , than 60 defense, so the function returns ""Yes"".,Charmeleon is , Water type, and has , than 60 defense, so the function returns ""No"",Wartortle is , Water type and has , than 60 defense, so the function returns ""Yes"" ",,
Google Sheets ,MAX Function,"MAX Function,Max Function Example",,"The , function is a premade function in Google Sheets, which finds the highest number in a range.,It is typed , and gets a list of cells:,You can ,Let's have a look at an example!,Find the highest total stats in the range ,:,Now, the function returns the highest value from the cells in the range:, The function has successfully found the highest value, ,. Cloyster has the highest Total stats of the Pokemons in this list.,Let's add text to a cell in the range , to see what happens. Type Alakazam to into the cell ,:, The function ignores the text typed in the range. , is returned as the new highest value, since the old one was replaced with text. Poliwrath is now the Pokemon with the highest Total stats in the range ,.",,,
Google Sheets IF Function,,"IF Function,Example IF function (equal to),Example IF Function (greater than)",,"The , function is a premade function in Google Sheets, which returns values based on a , or , ,.,It is typed , and has 3 parts:,The , is referred to as ,, which can check things like:,Check if the Pokemon type is grass:,The condition is if the ""Type 1"" value for the Pokemon is ""Grass"".,The function returns ""Yes"" or ""No"".,Example , function, step by step:,Since the value in cell , is ""Grass"", the condition is , and the function will return ""Yes"".,The function can be repeated with the , for each row to perform the same check for each Pokemon:,Now, each row has a check for Grass Type:,Check if the Pokemon's total stats is , 500:,The function returns ""Yes"" or ""No"".,Example , function, step by step:,Since the value in cell , is 318, the condition is , and the function will return ""No"".,The function can be repeated with the , for each row to perform the same check for each Pokemon:,Now, each row has a check for having more than 500 total stats:","If a number is , another number ,If a number is , another number ,If a number or text is , to something ",,
Google Sheets ,COUNTIF Function,"COUNTIF Function,Countif Function Example",,"The , function is a premade function in Google Sheets, which counts cells that match a specified ,.,It is typed , and has two parts:,The , is referred to as ,, which can check things like:,Apply the , function to range ,, to count how many Pokemons there are of Fighting, Water and Grass types:, function, step by step:,The function now counts the number of Fighting type Pokemon.,The function can be repeated for Water and Grass type Pokemon compare them:,Now, we can see the number of Fighting, Water and Grass type Pokemon from this list:","If a number is , another number ,If a number is , another number ,If a number or text is , to something ",,
Google Sheets ,COUNTBLANK Function,"COUNTBLANK Function,Countblank Function Example",,"The , function is a premade function in Google Sheets, which counts blank cells in a range.,It is typed , and gets a list of cells:,You can ,Apply the , function to range ,, to find the Pokemons which do not have a 2nd Type:, function, step by step:,The , function successfully counted , blank cells in the range ,.",,,
Google Sheets COUNTA Function,,"COUNTA Function,Counta Function Example,Another Example (Numbers)",,"The , function is a premade function in Google Sheets, which counts cells that has values, both letters and numbers.,It is typed , and gets a list of cells:,You can ,Apply the ,  function to range ,. Counting Pokemons by their names, which are letters only:, function, step by step:,That's it! The , function successfully counted 20 cells with values in the range ,.,Apply the , function to the range ,, which only has cells with numbers., The , function counts cells in a range with values both numbers and letters.",,,
Google Sheets AVERAGEIF Function,,"AVERAGEIF Function,Example AVERAGEIF function",,"The , function is a premade function in Google Sheets, which calculates the , of a range based on a , or , ,.,It is typed , and has three parts:,The , is referred to as ,, which can check things like:,The , is the range where the function calculates the average.,Find the average speed of Grass type Pokemon:,The condition is that the type is ""Grass"".,Example , function, step by step:,The function now calculates the average speed value of the Grass type Pokemon: Bulbasaur, Ivysaur and Venusaur.,The function can be repeated for Fire and Water type Pokemon to compare them:,Now, we can see the average speed values of each type:","If a number is , another number ,If a number is , another number ,If a number or text is , to something ",,
Google Sheets COUNT Function,,"COUNT Function,Count Function Example,A Non-Working Example",,"The , function is a premade function in Google Sheets, which counts cells with numbers.,It is typed , and gets a list of cells:,You can ,Apply the ,  function to range ,. Counting the cells of Pokemon Total stats, which is numbers only:, function, step by step:,That's it! The , function successfully counted 20 cells with numbers.,Now, let us try an example that will not work.,Apply the , function to the range ,, which only has cells with letters.,It returns the value ,, no cells with numbers found. Range , only had cells with letters.",,,
Google Sheets AVERAGEIFS Function,,"AVERAGEIFS Function,Example AVERAGEIFS function",,"The , function is a premade function in Google Sheets, which calculates the , of a range based on one or more , or , ,.,It is typed ,:,The , are referred to as , and so on, which can check things like:,The ,, ,, and so on, are the ranges where the function check for the conditions.,The , is the range where the function calculates the average.,Find the average defense of Grass type 1st Generation Pokemon:,The conditions are that the type is ""Grass"" and Generation is 1.,Example , function, step by step:,The function now calculates the average defense value of the 1st Generation Grass type Pokemon: Bulbasaur, Ivysaur and Venusaur.,The function can be repeated for Fire type Pokemon and 2nd Generation to compare them:,Now, we can see the average defense values of each type between generations:,Notice how the 2nd Generation Grass type Pokemon got more defense, but the Fire type stayed the same.","If a number is , another number ,If a number is , another number ,If a number or text is , to something ",,
Google Sheets Location Settings,,"Location Settings,Example Location Settings,Changing Spreadsheet Location Settings",,"Google Sheets provides regional formatting settings for different languages and styles of presenting information.,Regional settings affects a number of things, like:, are the symbols used to separate arguments in a function.,The most common symbols are comma , and semicolon ,For example, the , regional language setting uses commas:,While , regional language settings uses semicolons:,Here are the date, decimal number, and formula delimiters shown with , location settings:,Here are the date, decimal number, and formula delimiters shown with , location settings:,Notice that the United States location formatting uses month/day/year and the German formatting uses day.month.year for calendar dates.,The United States location formatting also uses a period (,) for the decimal symbol and the German formatting uses a comma (,).,Changing Spreadsheet Location Settings is accessed in the Spreadsheet settings part of the , menu:,Selecting this option will open a dialog box where you can choose your preferred location settings:","Calendar date formatting,Decimal numbers,Default currency formatting,Formula delimiters",,
Google Sheets ,Formatting,"Formatting,Styling Commands in Ribbon,Styling Commands in Format menu,Example,Chapter summary",,"Google Sheets has many ways to format and style a spreadsheet.,Why format and style your spreadsheet?,Styling is about changing the looks of cells, such as changing colors, font, font sizes, borders, number formats, and so on.,The most used styling functions are:,There are two ways to access the styling commands in Google Sheets:,Read more about the Ribbon and the menu in the ,The Ribbon provides many formatting options such text and border coloring.,You can also select any cell or a range of cells and then click on the , menu in the menu bar:,In this example, different formatting options have been applied to range ,.,Formatting is used to make spreadsheets more readable. There are many ways to add styles. The most common ones are; Color, Font, Number format and Gridlines.","Make it easier to read and understand,Make it more presentable",,
Google Sheets Functions,,Functions,,"Google Sheets has many premade formulas, called ,.,Functions are typed by , and the functions name.,For example ,Once you have typed the function name you need to apply it to a range.,For example ,The range is always inside of parentheses.",,,
Google Sheets Parentheses,,"Parentheses,Without Parentheses,With One Parentheses,With Many Parentheses,Nesting Parentheses,Chapter Summary",,"Parentheses , are used to change the order of an operation.,Using parentheses makes Google Sheets do the calculation for the numbers inside the parentheses first, before calculating the rest of the formula.,Parentheses are added by typing , on both sides of numbers, like ,.,The result is , because it calculates ,The result is , because it calculates ,Let's have a look at some real examples in Google Sheets.,The result is ,, the calculation is ,. It uses , because ,.,The result is ,, the calculation is ,. It uses , because it has calculated numbers inside the parentheses , first.,The result is ,, the calculation is ,. The numbers inside the parentheses are calculated first.,When using more advanced formulas you may need to nest parentheses. You can look at this like an onion, which has many layers. Google Sheets will calculate the numbers inside the parentheses first, layer by later, starting with the inner most layer.
,It calculates the values flat as you would do with a calculator.,Let's break it down and explain.,Nesting creates layers like an onion. You can have many layers. This example uses two, the inner and outer layers.,It starts with calculating the numbers in the inner layer:,Parentheses can be used to change the order of an operation. The numbers inside the parentheses gets calculated first. A formula can have multiple sets of parentheses. More advanced formulas can use nesting to create layers of operations, like an onion. It calculates the inner most layer first, then the next, and so on.",,,
Google Sheets COUNTIFS Function,,"COUNTIFS Function,Example COUNTIFS function",,"The , function is a premade function in Google Sheets, which counts cells in a range based on one or more , or , ,.,It is typed ,:,The , are referred to as , and so on, which can check things like:,The ,, ,, and so on, are the ranges where the function check for the conditions.,Find the number of 1st Generation Water type Pokemon:,The conditions are that the type is ""Water"" and Generation is 1.,Example , function, step by step:,The function now counts the number of 1st Generation Water type Pokemon.,The function can be repeated for Water type Pokemon for the following Generations to compare them:,Now, we can see the total number of Water type Pokemon between generations 1-4:","If a number is , another number ,If a number is , another number ,If a number or text is , to something ",,
Google Sheets AVERAGE Function,,"AVERAGE Function,Average Function Example,Another Example",,"The , function is a premade function in Google Sheets, which calculates the average (arithmetic mean).,It is typed , and gets a list of cells:,You can ,It adds up all the cell values and divides that sum by the total number of values.,Let's have a look at an example where we help the Pokemon trainers to calculate the average of Pokeballs per trainer.,How to use the , function, step by step:,Google Sheets will often give suggestions of how to complete your function based on the data in the spreadsheet.,In this case, the suggestion is precisely what we are looking for, the range ,.,Click the suggestion, hit enter, and the function is complete!,The function can be repeated with the , for each row to calculate the average number of Pokeballs for all the Trainers:,You have successfully calculated the average using the ,function.,The suggestions are often very helpful for doing things quickly, but don't always suggest precisely what we want.,Let's have a look at a similar example, where the Pokeon trainers have another item in their inventory:,How to use the , function, step by step:,The function now calculates the average of the cell , together with the range ,.,The function can be repeated with the , for each row to calculate the average number of Pokeballs for all the Trainers:,Now, we can see the average number of Pokeballs for each of the trainers:",,,
Google Sheets Absolute References,,Absolute References,,"Absolute reference is when a reference has the dollar sign (,).,It locks a reference in the formula. ,Add , to the formula to use absolute references.,The dollar sign has three different states:,Let's have a look at an example helping the Pokemon trainers to calculate prices for Pokeballs,Type or copy the following data:,The price's reference is ,, we do not want the fill function to change this, so we lock it. ,The reference is absolutely locked by using the formula ,.,How to do it, step by step:, You successfully calculated the prices for the Pokeballs using an absolute reference.","Absolute for column and row. The reference is absolutely locked.
  ,  Example ,Absolute for the column. The reference is locked to that column. The row remains relative.
  ,  Example ,  ,Absolute for the row. The reference is locked to that row. The column remains relative.
  ,  Example ,  ,There are 6 trainers: Iva, Liam, Adora, Jenny, Iben and Kasper. ,They have different amount of Pokeballs each in their shop cart,The price per Pokeball is 2 coins",,
Google Sheets Addition Operator,,"Addition Operator,Adding Two Manual Entries,Adding Two Cells,Adding Several Cells,Adding with SUM,Adding Using Absolute Reference,Adding with SUM",,"Addition uses the , symbol in Google Sheets, and is also known as ,.,There are two ways to do addition in Google Sheets. Either by using the , symbol in a formula or by using the, function.,How to add cell values:,You can add more cells to the formula by typing (+) between the cells.,Let's have a look at some examples. , You have successfully added ,.,First let's add some numbers to work with. Type the following values:,How to do it, step by step:, , is the result by adding , and ,.,First let's  add some numbers to work with. Type the following values:,Step by step to add several cells:, You have successfully added five cells!,Let's keep the numbers from the last exercise. If you did last exercise, remove the value in ,. ,Step by step to add with SUM:,You can also lock a cell and add it to other cells.,How to do it, step by step:,Let's have a look at an example where we add , to the range , using , and the ,.,Copy the values:,Let's keep the numbers from the last exercise. If you did last exercise, remove the value in ,. ,Step by step:, You have successfully used absolute reference to add , with the range ,.","Type ,Type ,Hit enter",,
Google Sheets Relative and Absolute References,,"Relative and Absolute References,Relative reference,A Non-Working Example",,"Cells in Google Sheets have unique references, which is their location.,References are used in formulas to do calculations, and the fill function can be used to continue formulas sidewards, downwards and upwards.,Google Sheets have two types of references:,Absolute reference is a choice we make. It is a command which tells Google Sheets to lock a reference.,The dollar sign (,) is used to make references absolute.,Example of relative reference: ,Example of absolute reference: ,References are relative by default, and are without dollar sign (,).,The relative reference makes the cells reference free. It gives the fill function freedom to continue the order without restrictions.,Let's have a look at a relative reference example, helping the Pokemon trainers to count their Pokeballs (,) and Great balls (,).,The result is: ,:,Next, fill the range ,:,The references being relative allows the fill function to continue the formula for rows downwards.,Have a look at the formulas in ,. You can do this by clicking ion the , menu and choosing ,.,Notice that Google Sheets calculates the next row as you fill. ,Let's try an example ,.,Fill ,, filling to the ,instead of downwards. Resulting in strange numbers:,Have a look at the formulas.,It assumes that we are calculating sidewards and not downwards.,The numbers that we want to calculate need to be in the same direction as we fill. ",,,
