H1_leftside_heading,H1_rightside_heading,H2,H3,All_para,li,div,div_2
Google Sheets Tutorial,,"Examples in Each Chapter,Copy Values Tool,Why Study Google Sheets?",,"We use practical examples to give the user a better understanding of the concepts.,Example values can be copied from the tutorial and into your spreadsheet, making it easy for you to tag along step-by-step:,Google Sheets is an widely used spreadsheet program.,Example use areas:",,,
Google Sheets ,Sort,"Google Sheets Sorting,Example",,"Google sheets has commands for sorting the data in , or , order.,: from the smallest to the largest for numbers and from A to Z for text.,: from the largest to the smallest for numbers and from Z to A for text.,Google sheets has the following sort commands:,The sort commands can be found in the , menu.,Sort the Pokemon by their total stats in ascending order (from smallest to largest).,Copy the values to follow along.,This is the result:,Now all the Pokemon are sorted by their total stats.,In the next chapter, you will learn more about , command in Google sheets.",,,
Google Sheets ,Clear Format,"Example (Remove Formatting For a Range),Example (Remove Formatting For Multiple Cells),Example (Remove Formatting For A Column),Example (Remove Formatting For All Cells)",,"Google Sheets lets you remove , formatting operations on a selected range.,The , command can be found in the , menu.,Remove formatting for a range, step by step:,This is the result:,Remove formatting for multiple cells, step by step:,This is the result:, You can now remove all types of formatting for any arrangements of cells.,Remove formatting for a column, step by step:,This is the result:,You can do the same with rows. ,Remove formatting for the entire spreadsheet, step by step:,This is the result:, You have successfully removed all formatting in your sheet.",,,
Google Sheets ,Sort Range By Column,"Sort Range By Column,Example (Sort Text),Example (Sort Numbers),A Non-Working Example (Sorting One Column In A Range),Sorting More Than One Column",,"Google sheet lets you sort data in a range by columns,It is possible to sort data in a sheet by range.,The sort commands can be found in the , menu.,Sort the Pokemon in the range , by their ,, ascending from smallest to largest (A-Z).,Copy the values to follow along.,This is the result:,Sort the Pokemon ascending by their , from smallest to largest.,Copy the values to follow along.,This is the result:, The Pokemon were successfully sorted by their , from smallest to largest. The sort commands work for both text and numbers.,This example shows how sorting column by range can break the relationship between multiple data columns.,In this example we have two columns with related data. Column , is the Pokemon , and Column , is their ,. Try sorting just one of the columns (,) ascending by their ,.,Copy the values to follow along.,This is the result:,The image above shows that the relationship between column , and , is broken. The Pokemon now have wrong Total stats.,Select the whole range when sorting ranges with more than one column.,When sorting multiple columns, the sorting is done based on the column with , having the blue rectangle. This is the cell that you start selecting your range with.,In the image below the sorting is done based on the , values in column ,In the image below the sorting is done based on the , values in column ,This example shows how to sort data without losing the relationship between the data columns.,Sort the Pokemon based on their names in ascending order.,Copy the values to follow along.,This is the result:,By selecting range , the sort is done correctly, keeping the relationship between the data (Column , and ,).,Now try to sort Pokemon based on their total stats in a descending order.",,,
Google Sheets Conditional Formatting,,"Conditional Formatting,Conditional Formatting Example,Clear Formatting,Manage Formatting",,"Conditional formatting is used to change the , of cells in a range based on your specified ,.,The conditions are rules based on specified numerical values, matching text and more.,Google Sheet provides a number of preset formatting options, as well as customizable format options and conditions.,The two main Conditional Formatting options are:, formatting applies a single customizable formatting option to all the cells that match a condition., formatting applies a background color that smoothly changes between 2 or 3 colors based on the values of cells in a range.,Here, the Speed values of each pokemon is formatted with a ,:,Conditional Formatting can be removed by selecting the range of cells you want to remove the conditional formatting from and selecting the , option from the , menu:,Rules can also be removed in the right-hand side Conditional format rules menu.,Conditional Formatting can be managed in the right-hand menu.,The menu is accessed by selecting the range of cells that already have conditional format rules and selecting , from the , menu.,From this menu you can ,:,You can , rules by clicking the recycling bin icon:,Click the four vertical dots on the left of a rule and drag up or down to , the rules:",,,
Google Sheets Color Scale Formatting,,"Color Scale Formatting,Color Scale Options,Color Scale Formatting Example (Min/Max Values)",,"Color Scales are premade types of conditional formatting in Google Sheets used to highlight cells in a range to indicate how large or small the cell values are.,Here is the Color scale part of the conditional format rules menu:,You can access the menu by selecting the , option in the , menu.,From the conditional format rules menu you can choose:,In the , field you can enter the cells and ranges that the color scale applies to.,You can enter cells and ranges separated by a comma , into the field.,You can also click the icon in the right of the field to select data ranges:,This will open a dialog box where you can add ranges by selection:,You can customize the color scale by selecting min/mid/max point color icons on the right-hand side:,This will bring up a color picking menu. See the , for a detailed guide of how to customize colors.,The color scale will apply relative to the chosen min/mid/max points.,The default option is ,:,With the Min/Max value option, google sheets will choose the min and max points based on the largest and smallest values in the selected range.,The other options are:,These options will let you specify precisely what the min, mid, and max points should be.,Highlight the Speed values of each Pokemon with , conditional formatting.,Conditional formatting, step by step:,The Conditional Formatting menu will appear in the right-hand side of the spreadsheet:,There are 9 default color scale options to choose from.,The color at the right-hand side of the icons , will apply to the highest values by default.,Now, the Speed value cells will have a colored background highlighting:,Dark green is used for the highest values, and white for the lowest values.,Charizard has the highest Speed value (100) and Squirtle has the lowest Speed value (43).,All the cells in the range gradually change color from dark green, to ligher greens and then to white.","Which cells the color scale applies to,What colors the scale uses,The min, mid, and max points,Number,Percent,Percentile",,
Google Sheets ,Format Gridlines,Gridlines,,"By default, gridlines are displayed in Google Sheets.,However, gridlines can be removed.,Why remove gridlines?,How to Remove Gridlines","Make the spreadsheet more readable,Make the spreadsheet more presentable",,
Google Sheets ,Sort Range,"Sort Range,Handling Data with Headers,Multi-Level Sorting",,"The , command in Google Sheets allows for more complex sorting of data.,For example it can work with data which has headers or have multiple sort rules.,Sort range makes it very easy to sort data with headers.,Sort the Pokemon in the range , by their ,, ascending from smallest to largest (A-Z).,Copy the values to follow along.,Sort range, step by step:, You have successfully sorted the Pokemon by their total stats.,Google Sheets lets you sort your data in multiple levels.,Sort the Pokemon in the range , by their ,, ascending from smallest to largest (A-Z) and then sort the results based on their ,.,Multi-level sort range, step by step:,Let's compare the results of this example with the previous example:,The image with the , rectangle is the result of the first example and the image with the , rectangle is the result of the second example.,Look at rows ,.,The order of Pokemon has changed. In the second example they are also sorted alphabetically.,This is because we added an additional sort rule to ,.",,,
Google Sheets ,Format Numbers,"Number Formats,Decimals,Chapter summary",,"The default Number format is ,.,Why change number formats?,Examples of number formats:,Number formats can be changed by clicking the Number format dropdown (,), accessed in the Ribbon, found in the Numbers group.,In the example we have cells that represent prices, which can be formatted as Currency.,Copy the values to follow along.,Let's try to change the format of the prices to the Currency Number format.,Step by step:, The Number format was changed from , to ,.,Now, do the same for cells ,, , and ,:,Did you make it? ,Notice that the numbers look like a mess. Let's solve that by decreasing the decimals. This helps to make the presentation more neat.,The number of decimals can be increased and decreased.,There are two commands:,Clicking them reduces or increases the number of decimals.,The commands can be found next to the Number format dropdown menu.,Let's clean this up, step by step:,Do the same for cells ,, , and ,:,Number formats can be changed to make the spreadsheet more understandable or to prepare cells for functions. You can increase and decrease decimals to make the presentation neat.","Make data explainable,Prepare data for functions, so that Google Sheets understands what kind of data you are working with.,Automatic,Number,Currency,Time,Increase Decimal (,),Decrease Decimal (,)",,
Google Sheets Single Color Formatting,,"Single Color Formatting,Single Color Options,Single Color Formatting Example (Text Ends With)",,"Single Color is a premade type of conditional formatting in Google Sheets used to apply a customizable formatting option to all the cells that match a ,.,Here is the Single Color part of the conditional format rules menu:,You can access the menu by selecting the , option in the , menu.,From the conditional format rules menu you can choose:,In the , field you can enter the cells and ranges that the Single Color applies to.,You can enter cells and ranges separated by a comma , into the field.,You can also click the icon in the right of the field to select data ranges:,This will open a dialog box where you can add ranges by selection:,You can choose which rule to apply from the , drop down menu. There are many options:,The Single Color formatting lets you customize both the background color and the font of the cells.,See the , and , for detailed guides of how to customize colors and fonts.,Highlight the Pokemon name values , , with , conditional formatting.,Conditional formatting, step by step:,The Conditional Formatting menu will appear in the right-hand side of the spreadsheet:,Now, the Name value cells will have a colored background highlighting if the name ends with ""saur"":","Which cells the conditional formatting applies to,Which format rule is used,The formatting style,Empty or not Empty cells,Text Contains or not Contains,Text Starts or Ends with,Text is Exactly,Calendar Dates,Greater than,Less than,Equal to,Between or not Between,Custom rules",,
Google Sheets ,Sort Sheet By Column,"Sort Sheet By Column,Example,Example (Sort Sheet By Column, Another Way),Non-Working Example (Sort Sheet By Column with Headers)",,"Sorting a sheet by column , the relation between multiple data columns.,The sort commands can be found in the , menu.,Sort the Pokemon by their names in ascending order (from A to Z).,Copy the values to follow along.,This is the result:,Now all the Pokemon are sorted by their names.,This example shows another way to sort Pokemon names in ascending order (from A to Z).,This is the result:,Sort the Pokemon by their names in ascending order (from A to Z).,Copy the values to follow along.,Unlike the first example, the data for this example has ,.,Let's see what happens if we sort this data.,This is the result:,Notice anything ,The headers are also sorted,This is why sort sheet by colum is not suitable for data with headers.",,,
Google Sheets ,Format Fonts,"Format Fonts,Fonts",,"You can format fonts in four different ways: color, font name, size and other characteristics.,The default font in Google Sheets is ,.,The font can be changed for both numbers and text.,Why change the font in Google Sheets?,How to change the font:,Let's have a look at an example.,The example has both text (,) and numbers (,), You have successfully changed the fonts from , to , for the range ,.","Make the data easier to read,Make the presentation more appealing",,
Google Sheets ,Format Painter,"Format Painter,How To Use the Format Painter,Copy and Paste Color to Multiple Cells,Copy Font Characteristics",,"The format painter is a command which lets you copy formatting from one cell to another. ,It is a great tool, which saves you lots of time!,The Format painter can be used to copy to single cells or ranges. ,Format Painter is used by clicking on its button (,) in the Ribbon.,Let's try some examples and copy formats with Colors and font Characteristics, such as bold, italic and underline:,Copy the red color from cell , to cell ,.,Step by step:,Notice the dotted border around cell ,. This indicates that the format is copied and ready for pasting. Let's paste it to cell ,!,Copy cell , to cell ,. That is right, let's try to paste to a range of two cells!, The format painter can be used for single cells and on ranges.,Now do it yourself! Copy the format from cell , to range ,.,Last example. Copy the font characteristics from range , to range ,.,Step by step:",,,
Google Sheets XOR Function,,"XOR Function,Example XOR Function,Example XOR Function (with IF)",,"The , function is a premade function in Google Sheets, which returns , or , based on two or more ,.,It is typed ,:,The , are referred to as ,, ,, and so on.,The conditions can check things like:,For two conditions, you can think of the XOR function as:
"", this , that, but ,"",Check if the Pokemon type is either Fire type , has HP , 60, but ,:,The function returns ""TRUE"" or ""FALSE"".,Example , function, step by step:,Since the value in cell , is not ""Fire"" the first condition is ,.,Since the value in cell , is less than 60 the second condition is also ,.,For two conditions, , condition should to be  , for the XOR function to return ,.,The function can be repeated with the , for each row to perform the same check for each Pokemon:,Now, each row has a check for Fire Type , HP less than 60, but ,:,For example:,Combining the XOR function with an , lets you check , conditions for the IF function:,The IF function is typed , and has 3 parts:,The XOR function takes the place of the , condition.,Here, the , function returns ""Yes"" or ""No"".,Example , function as the condition for , function, step by step:,The function can be repeated with the , for each row to perform the same check for each Pokemon:,Now, each row has a check for Water Type , Defense greater than 60, but ,:,For example:","If a number is , another number ,If a number is , another number ,If a number or text is , to something ,Ivysaur is , Fire type, but it also does not have , than 60 defense, so the function returns ""FALSE"".,Charmeleon , Fire type, and has , than 60 defense, so the function returns ""FALSE"",Wartortle is , Fire type, but has , than 60 defense, so the function returns ""TRUE"" ,Ivysaur is , Fire type, but it also does not have , than 60 defense, so the function returns ""No"".,Charmeleon , Fire type, and has , than 60 defense, so the function returns ""No"",Wartortle is , Fire type, but has , than 60 defense, so the function returns ""Yes"" ",,
Google Sheets ,VLOOKUP Function,"VLOOKUP Function,Vlookup Function Example",,"The , function is a premade function in Google Sheets, which 
allows searches across columns.,It is typed , and has the following parts:, Select the cell where search values will be entered., The table range, including all cells in the table., The data which is being looked up. The input 
is the number of the column, counted from the left:, TRUE/1 if the range is sorted or FALSE/0 if it is not sorted. ,Let's have a look at an example!,Lookup and return Pokemon names from this list by their ,:,The , function, step by step:, is where the search result is displayed. In this case, the Pokemon's names based on their ID#., selected as ,. This is the cell where the search query is entered. In this case the Pokemon's ,.,In this example the table is sorted by ,, so the , value is ,.,An illustration for selecting column , number ,:,Now, the function returns the Name value of the , specified in cell ,:, The function returns the , value. This is because there have not been entered any value to the Search ID# cell ,.,Let us feed a value to it, type , into cell ,:, The , function has successfully found the Pokemon Squirtle which has the ID# ,.,One more time, type , into cell ,:, The function returned Charmanders name, which has , as its ID#. ,.,Let's try another example, using the Pokemon names as input instead.,First, change the places of columns , and ,.,Clicking and holding coloumn A and dragging it between columns B and C will rearrange them like this:,Now, the function is trying to look up , in the Name column, which returns the , error.,Let's switch the labels, and try to enter , into the cell ,, where the vlookup functions finds the ,:,Notice that the ID# returned is 1, although Caterpie's ID# is actually 10.,This result is another error.,This is because the Name values are not , like the ID numbers are.,Let's change the value of the , part of the function from , to ,:,Now, the function correctly returns Caterpie's real ID number:",,,
Google Sheets AND Function,,"AND Function,Example AND Function,Example AND Function (with IF)",,"The , function is a premade function in Google Sheets, which returns , or , based on two or more ,.,It is typed , and takes two or more conditions.,The , are referred to as ,, ,, and so on.,The conditions can check things like:,Check if the Pokemon type is fire , has speed , 70:,The function returns ""TRUE"" or ""FALSE"".,Example , function, step by step:,Since the value in cell , is not ""Fire"" the first condition is ,.,Since the value in cell , is less than 70 the second condition is also ,., conditions need to be , for the AND function to return ,.,The function can be repeated with the , for each row to perform the same check for each Pokemon:,Only Charmeleon and Charizard both have Fire type and speed greater than 70, so the function returns ""TRUE"".,Combining the AND function with an , lets you check , conditions for the IF function:,The IF function is typed , and has 3 parts:,The AND function takes the place of the , condition.,Here, the , function returns ""Yes"" or ""No"".,Example , function as the condition for , function, step by step:,The function can be repeated with the , for each row to perform the same check for each Pokemon:,Now each row has a check for both being Fire type and Speed greater than 70:,Only Charmeleon and Charizard both have Fire type and speed greater than 70, so the function returns ""Yes"".","If a number is , another number ,If a number is , another number ,If a number or text is , to something ",,
Google Sheets SUMIFS Function,,"SUMIFS Function,Example SUMIFS function",,"The , function is a premade function in Google Sheets, which calculates the sum of a range based on one or more , or , ,.,It is typed ,:,The , are referred to as ,, ,, and so on, which can check things like:,The ,, ,, and so on, are the ranges where the function check for the conditions.,The , is the range where the function calculates the sum.,Find the sum of total stats for Water type 1st Generation Pokemon:,The conditions are that the type is ""Water"" and Generation is 1.,Example , function, step by step:,The function now calculates the sum of total stats for the 1st Generation Water type Pokemon.,The function can be repeated for the following Generations to compare them:,Now, we can see the sum of total stats of Water type Pokemon between generations:","If a number is , another number ,If a number is , another number ,If a number or text is , to something ",,
Google Sheets ,Format Borders,"Format Borders,Adding Borders,Border Colors,Border Style,Chapter Summary",,"Borders can be added and removed. Colors and style can be changed.,Why format borders?,The Borders menu is accessed in the Ribbon (,).,The button remembers the border you used last time.,Borders are added by clicking the , (,) button.,The default border is black underline.,Changing the border type, style or color is a choice you make.,Clicking the option button gives an overview of the different border options.,The buttons inside the Border command give options for more types of borders.,Colored borders are added by selecting a color before adding the border.,The color can be changed in the Border Color menu (,):,Borders styles can be changed.,The menu is accessed in the Border Style menu (,):,Google Sheets offers 6 different border styles:,Borders can be added with different colors and styles. The border button remembers the border settings used the last time. The options are accessed from the border options button, next to the border button.,In the next chapter you will learn about Number formats.","Make the document more readable and understandable,Emphasizing key points,Solid line,Dashed line,Dotted line,Medium line,Thick line,Double line",,
Google Sheets ,Format Colors,"Colors,Theme and Standard Colors,Custom Colors,Applying colors",,"Colors are specified by selection or by using Hexadecimal (HEX) codes.,Google Sheets has a set of standard, theme and custom colors available for use. You select a color by clicking on it:,The option with this symbol , allows you to select custom colors.,Google Sheets supports Hexadecimal color codes.,A hexadecimal color code is specified with: ,.,RR (red), GG (green) and BB (blue) are hexadecimal values between 00 and FF specifying the intensity of the color.,For example, #0000FF is displayed as blue, because the blue component is set to its highest value (FF) and the others are set to 00.,Colors can be applied to cells, text and borders.,Colors are applied to cells by using the "","" function.,Apply colors to cells step by step:,The "","" button remembers the color you used the last time.,The , command allows selection of theme colors, standard colors or use of HEX codes by clicking on the , option:,Starting with ,and ,colors:,Try to apply the following colors:,Did you make it?,Let's apply colors using HEX codes.,Apply HEX code , to range,:,Step by step:,Notice that entering the HEX code shows you where the color is positioned on the color map., You have successfully applied colors using the standard, theme and HEX codes.","Theme color blue to range ,.,Theme color green to range ,.",,
Google Sheets ,SUM Function,"SUM Function,Sum Function Example",,"The , function is a premade function in Google Sheets, which adds up numbers in a range.,It is typed ,and gets a list of cells:,You can ,Let's see some examples!,Calculate the sum of all the Total stats for this list of Pokemon:,The ,SUM function, step by step:,Now, the function calculates the sum of Total stats for the Pokemon in the list:, You have successfully calculated the sum of the stats using the , function. The Pokemon's stats have a total sum of ,.,Let's change one of the values in the range, to see what happens. Type , into cell ,:, total stats was changed from , to ,. ,The , function updated the total sum from , to ,.,It updates the , when values inside of the range are changed.,Lets change , stats to a negative number to see what happens. Type , into cell ,:,The , is updated to ,. Adding a negative number subtracts that value from the range.",,,
Google Sheets SUMIF Function,,"SUMIF Function,Example SUMIF function",,"The , function is a premade function in Google Sheets, which calculates the sum of values in a range based on a , or , ,.,It is typed ,:,The , is referred to as ,, which can check things like:,The , is the range where the function calculates the sum.,Find the sum of Total stats for Grass type Pokemon:,The condition is that the type is ""Grass"".,Example , function, step by step:,The function now sums the Total stats for Grass type Pokemon.,The function can be repeated for the other Pokemon types to compare them:,Now, we can see the sum of total stats for the different types of Pokemon:","If a number is , another number ,If a number is , another number ,If a number or text is , to something ",,
Google Sheets ,STDEV.S Function,"STDEV.S Function,STDEV.S Function Example",,"The , function is a premade function in Google Sheets, which calculates the , for a sample of a population.,It is typed , and gets a list of cells:,You can ,The STDEV.S function ignores cells that do not contain numbers. ,Let's have a look at an example!,Find the standard deviation of the total stats for the Pokemon in this sample:,The , function, step by step:,Now, the function returns the standard deviation of all the Total stat values:,The , function has successfully returned the , for the sample as ,.",,,
