H1_leftside_heading,H1_rightside_heading,H2,H3,All_para,li,div,div_2
Matplotlib ,Labels and Title,"Create Labels for a Plot,Create a Title for a Plot,Set Font Properties for Title and Labels,Position the Title","Example,Result:,Example,Result:,Example,Result:,Example,Result:","With Pyplot, you can use the , and , functions to set a label for the x- and y-axis.,With Pyplot, you can use the , function to set a title for the plot.,You can use the , parameter in
,, ,, 
and , to set font properties for the 
title and labels.,You can use the , parameter in
, to position the title.,Legal values are: 'left', 'right', and 'center'. Default value is 'center'.",,,
Matplotlib ,Line,"Linestyle,Shorter Syntax,Line Styles,Line Color,Line Width,Multiple Lines","Example,Result:,Example,Result:,Example,Result:,Example,Result:,Example,Result:,Example,Result:,Example,Result:,Example,Result:,Example,Result:","You can use the keyword argument ,, or shorter ,, to 
change the style of the plotted line:,The line style can be written in a shorter syntax:, can be written as ,., can be written as ,., can be written as ,.,You can choose any of these styles:,You can use the keyword argument , or 
the shorter , to set the color of the line:,You can also use ,:,Or any of the ,.,You can use the keyword argument , or 
the shorter , to change the width of the line.,The value is a floating number, in points:,You can plot as many lines as you like by simply adding more , functions:,You can also plot many lines by adding the points for the x- and y-axis for each line in the same , function.,(In the examples above we only specified the points on the y-axis, meaning that the points on the x-axis got the the default values (0, 1, 2, 3).),The x- and y- values come in pairs:",,,
Matplotlib ,Scatter,"Creating Scatter Plots,Compare Plots,Colors,Color Each Dot,ColorMap,Size,Alpha,Combine Color Size and Alpha","Example,Result:,Example,Result:,Example,Result:,Example,Result:,Example,Result:,Example,Result:,Example,Result:,Example,Result:,Example,Result:","With Pyplot, you can use the , function 
to draw a scatter plot.,The , function plots one dot for 
each observation. It needs two arrays of the same length, one for the values of 
the x-axis, and one for values on the y-axis:,The observation in the example above is the result of 13 cars passing by.,The X-axis shows how old the car is.,The Y-axis shows the speed of the car when it passes.,Are there any relationships between the observations?,It seems that the newer the car, the faster it drives, but that could be a coincidence, after all we only registered 13 cars.,In the example above, there seems to be a relationship between speed and age,
but what if we plot the observations from another day as well?
Will the scatter plot tell us something else?,By comparing the two plots, I think it is safe to say that they both gives us the same conclusion: the newer the car, the faster it drives.,You can set your own color for each scatter plot with the
, or the , 
argument:,You can even set a specific color for each dot by using an array of colors as value for the
, argument:,The Matplotlib module has a number of available colormaps.,A colormap is like a list of colors, where each color has a value that ranges 
from 0 to 100.,Here is an example of a colormap:,
  ,
,This colormap is called 'viridis' and as you can see it ranges from 0, which 
is a purple color, and up to 100, which is a yellow color.,You can specify the colormap with the keyword argument
, with the value of the colormap, in this 
case , which is one of the 
built-in colormaps available in Matplotlib.,In addition you have to create an array with values (from 0 to 100), one value for each of 
the point in the scatter plot:,You can include the colormap in the drawing by including the , statement:,You can choose any of the built-in colormaps:,You can change the size of the dots with the 
, argument.,Just like colors, make sure the array for sizes has the same length as the arrays for the x- and y-axis:,You can adjust the transparency of the dots with the 
, argument.,Just like colors, make sure the array for sizes has the same length as the arrays for the x- and y-axis:,You can combine a colormap with different sizes on the dots. This is best visualized if the dots are transparent:",,,
Matplotlib ,Adding Grid Lines,"Add Grid Lines to a Plot,Specify Which Grid Lines to Display,Set Line Properties for the Grid","Example,Result:,Example,Result:,Example,Result:,Example,Result:","With Pyplot, you can use the , function to add grid lines to the plot.,You can use the , parameter in
the , function to specify which grid lines 
to display.,Legal values are: 'x', 'y', and 'both'. Default value is 'both'.,You can also set the line properties of the grid, like this: grid(color = ',', 
linestyle = ',', linewidth = ,).",,,
Matplotlib ,Markers,"Markers,Marker Reference,Format Strings ,Line Reference,Color Reference,Marker Size,Marker Color","Example,Result:,Example,Result:,Example,Result:,Example,Result:,Example,Result:,Example,Result:,Example,Result:,Example,Result:,Example,Result:","You can use the keyword argument , to 
emphasize each point with a specified marker:,You can choose any of these markers:,You can use also use the , parameter to specify the marker.,This parameter is also called ,, and is written with this syntax:,The marker value can be anything from the Marker Reference above.,The line value can be one of the following:,The short color value can be one of the following:,You can use the keyword argument , or the 
shorter version, , to set the size of the markers:,You can use the keyword argument , or 
the shorter , to set the color of the , of the markers:,You can use the keyword argument , or 
the shorter , to set the color inside the edge of the markers:,Use ,the , and , arguments to color of the entire marker:,You can also use ,:,Or any of the ,.",,,
Matplotlib ,Pyplot,Pyplot,"Example,Result:","Most of the Matplotlib utilities lies under the , submodule,
and are usually imported under the , alias:,Now the Pyplot package can be referred to as ,.",,,
Matplotlib ,Plotting,"Plotting x and y points,Plotting Without Line,Multiple Points,Default X-Points","Example,Result:,Example,Result:,Example,Result:,Example,Result:","The , function is used to draw points (markers) in a diagram.,By default, the , function draws a line from point to point.,The function takes parameters for specifying points in the diagram.,Parameter 1 is an array containing the points on the ,.,Parameter 2 is an array containing the points on the ,.,If we need to plot a line from (1, 3) to (8, 10), we have to pass two arrays [1, 8] and [3, 10] to the plot function.,To plot only the markers, you can use , parameter 'o', which means 'rings'.,You can plot as many points as you like, just make sure you have the same number of points in both axis.,If we do not specify the points in the x-axis, they will get the default values 0, 1, 2, 3, (etc. depending on the length of the y-points.,So, if we take the same example as above, and leave out the x-points, the diagram will look like this:",,,
Matplotlib ,Tutorial,"What is Matplotlib?,Where is the Matplotlib Codebase?",,"Matplotlib is a low level graph plotting library in python that serves as a visualization utility.,Matplotlib was created by John D. Hunter.,Matplotlib is open source and we can use it freely.,Matplotlib is mostly written in python, a few segments are written in C, Objective-C and Javascript for Platform compatibility.,The source code for Matplotlib is located at this github repository ",,,
SciPy ,Tutorial,"Learning by Reading,Learning by Quiz Test,Learning by Exercises,Learning by Examples",Example,"We have created 10 tutorial pages for you to learn the fundamentals of SciPy:,Test your SciPy skills with a quiz test.,In our ""Try it Yourself"" editor, you can use the SciPy module, and modify the code to see the result.",,,
Pandas ,Tutorial,"Learning by Reading,Learning by Quiz Test,Learning by Exercises,Learning by Examples",Example,"We have created 14 tutorial pages for you to learn more about Pandas.,Starting with a basic introduction and ends up with cleaning and plotting data:,Test your Pandas skills with a quiz test.,In our ""Try it Yourself"" editor, you can use the Pandas module, and modify the code to see the result.",,,
Matplotlib ,Getting Started,"Installation of Matplotlib,Import Matplotlib  ,Checking Matplotlib Version",Example,"If you have , and , already installed on a system, then installation of 
Matplotlib is very easy.,Install it using this command:,If this command fails, then use a python distribution that already has Matplotlib installed,  like Anaconda, Spyder etc.,Once Matplotlib is installed, import it in your applications by adding the
, statement:,Now Matplotlib is imported and ready to use:,The version string is stored under , 
attribute.",,,
NumPy ,Tutorial,"Learning by Reading,Learning by Quiz Test,Learning by Exercises,Learning by Examples",Example,"We have created 43 tutorial pages for you to learn more about NumPy.,Starting with a basic introduction and ends up with creating and plotting random data sets, and working with NumPy functions:,Test your NumPy skills with a quiz test.,In our ""Try it Yourself"" editor, you can use the NumPy module, and modify the code to see the result.",,,
Python ,Delete File,"Delete a File,Check if File exist:,Delete Folder","Example,Example,Example","To delete a file, you must import the OS module, and run its
, function:,To avoid getting an error, you might want to check if the file exists before you try to delete it:,To delete an entire folder, use the , method:",,,
Python ,File Open,"File Handling,Syntax",,"File handling is an important part of any web application.,Python has several functions for creating, reading, updating, and 
deleting files.,The key function for working with files in Python is the
, function.,The , function takes two parameters;
,, and ,.,There are four different methods (modes) for opening a file:,In addition you can specify if the file should be handled as binary or text mode,To open a file for reading it is enough to specify the name of the file:,The code above is the same as:,Because , for read, and 
, for text are the default values, you do not need to specify them.",,,
Python ,File Open,"Open a File on the Server,Read Only Parts of the File,Read Lines,Close Files","Example,Example,Example,Example,Example,Example,Example","Assume we have the following file, located in the same folder as Python:,To open the file, use the built-in , function.,The , function returns a file object, which has a 
, method for reading the content of the file:,If the file is located in a different location, you will have to specify the file path, 
like this:,By default the , method returns the whole text, but you can also specify how many characters you want to return:,You can return one line by using the , method:,By calling , two times, you can read the 
two first lines:,By looping through the lines of the file, you can read the whole file, line by line:,It is a good practice to always close the file when you are done with it.",,,
Python ,String Formatting,"String format(),Multiple Values,Index Numbers,Named Indexes","Example,Example,Example,Example,Example,Example","To make sure a string will display as expected, we can format the result with 
the , method.,The , method allows you to format selected parts of a string.,Sometimes there are parts of a text that you do not control, maybe 
they come from a database, or user input?,To control such values, 
add placeholders (curly brackets ,) in the text, and run the values through the 
, method:,You can add parameters inside the curly brackets to specify how to convert 
the value:,Check out all formatting types in our ,.,If you want to use more values, just add more values to the format() method:,And add more placeholders:,You can use index numbers (a number inside the curly brackets ,) to be sure the 
values are placed 
in the correct placeholders:,Also, if you want to refer to the same value more than once, use the index number:,You can also use named indexes by entering a name inside the curly brackets ,, 
but then you must use names when you pass the parameter values
,:",,,
Python ,User Input,User Input,"Python 3.6,Python 2.7","Python allows for user input.,That means we are able to ask the user for input.,The method is a bit different in Python 3.6 than Python 2.7.,Python 3.6 uses the , method. ,Python 2.7 uses the , method. ,The following example asks for the username, and when you entered the username, it gets printed on 
the screen:",,,
Python ,File Write,"Write to an Existing File,Create a New File","Example,Example,Example,Example","To write to an existing file, you must add a parameter to the
, function:, - Append - will append to the end of the file, - Write - will overwrite any existing content,To create a new file in Python, use the , method, 
with one of the following parameters:, - Create - will create a file, returns 
an error if the file exist, - Append - will create a file if the 
specified file does not exist, - Write - will create a file if the 
specified file does not exist,Result: a new empty file is created!",,,
Python ,If ... Else,"Python Conditions and If statements,Indentation,Elif,Else,Short Hand If,Short Hand If ... Else,And,Or,Nested If,The pass Statement","Example,Example,Example,Example,Example,Example,Example,Example,Example,Example,Example","Python supports the usual logical conditions from mathematics:,These conditions can be used in several ways, most commonly in ""if statements"" and loops.,An ""if statement"" is written by using the , keyword.,In this example we use two variables, , and ,,
which are used as part of the if statement to test whether , is greater than ,.
As , is ,, and , is ,,
we know that 200 is greater than 33, and so we print to screen that ""b is greater than a"".,Python relies on indentation (whitespace at the beginning of a line) to define scope in the code. Other programming languages often use curly-brackets for this purpose.

,The , keyword is pythons way of saying ""if the previous conditions were not true, then 
try this condition"".,In this example , is equal to ,, so the first condition is not true, but the , condition is true, so we print to screen that ""a and b are equal"".,The , keyword catches anything which isn't caught by the preceding conditions.,In this example , is greater than ,,
so the first condition is not true, also the , condition is not true,
so we go to the , condition and print to screen that ""a is greater than b"".,You can also have an , without the
,:,If you have only one statement to execute, you can put it on the same line as the if statement.,If you have only one statement to execute, one for if, and one for else, you can put it 
all on the same line:,You can also have multiple else statements on the same line:,The , keyword is a logical operator, and 
is used to combine conditional statements:,The , keyword is a logical operator, and 
is used to combine conditional statements:,You can have , statements inside 
, statements, this is called ,
, statements., statements cannot be empty, but if you 
for some reason have an , statement with no content, put in the , statement to avoid getting an error.","Equals: ,Not Equals: ,Less than: ,Less than or equal to: ,Greater than: ,Greater than or equal to: ",,
Python ,Dictionaries,"Dictionary,Dictionary Items,Ordered or Unordered?,Changeable,Duplicates Not Allowed,Dictionary Length,Dictionary Items - Data Types,type(),Python Collections (Arrays)","Example,Example,Example,Example,Example,Example","Dictionaries are used to store data values in key:value pairs.,A dictionary is a collection which is ordered*, changeable and do not 
allow duplicates.,Dictionaries are written with curly brackets, and have keys and values:,Dictionary items are ordered, changeable, and does not allow duplicates.,Dictionary items are presented in key:value pairs, and can be referred to by 
using the key name.,When we say that dictionaries are ordered, it means that the items have a defined order, and that order will not change.,Unordered means that the items does not 
have a defined order, you cannot refer to an item by using an index.,Dictionaries are changeable, meaning that we can change, add or remove items after the 
dictionary has been created.,Dictionaries cannot have two items with the same key:,To determine how many items a dictionary has, use the , function:,The values in dictionary items can be of any data type:,From Python's perspective, dictionaries are defined as objects with the data type 'dict':,There are four collection data types in the Python programming language:,When choosing a collection type, it is useful to understand the properties of that type. Choosing the right type for a particular data set could mean retention of meaning, and, it could mean an increase in efficiency or security."," is a collection which is ordered and changeable. Allows duplicate members., is a collection which is ordered and unchangeable. Allows duplicate members., is a collection which is unordered, 
unchangeable*, and unindexed. No duplicate members., is a collection which is ordered** and changeable. No duplicate members.",,
Python ,Sets,"Set,Set Items,Unordered,Unchangeable,Duplicates Not Allowed,Get the Length of a Set,Set Items - Data Types,type(),The set() Constructor,Python Collections (Arrays)","Example,Example,Example,Example,Example,Example,Example","Sets are used to store multiple items in a single variable.,Set is one of 4 built-in data types in Python used to store collections of 
data, the other 3 are ,, 
,, and ,, all with different qualities and usage.,A set is a collection which is ,, ,, and ,.,Sets are written with curly brackets.,Set items are unordered, unchangeable, and do not allow duplicate values.,Unordered means that the items in a set do not have a defined order.,Set items can appear in a different order every time you use them, 
and cannot be referred to by index or key.,Set items are unchangeable, meaning that we cannot change the items after the set has been created.,Sets cannot have two items with the same value.,To determine how many items a set has, use the , 
function.,Set items can be of any data type:,A set can contain different data types:,From Python's perspective, sets are defined as objects with the data type 'set':,It is also possible to use the , 
constructor to make a set.,There are four collection data types in the Python programming language:,When choosing a collection type, it is useful to understand the properties of that type. Choosing the right type for a particular data set could mean retention of meaning, and, it could mean an increase in efficiency or security."," is a collection which is ordered and changeable. Allows duplicate members., is a collection which is ordered and unchangeable. Allows duplicate members., is a collection which is unordered, unchangeable*, and unindexed. No duplicate members., is a collection which is ordered** 
and changeable. No duplicate members.",,
Python ,Tuples,"Tuple,Tuple Items,Ordered,Unchangeable,Allow Duplicates,Tuple Length,Create Tuple With One Item,Tuple Items - Data Types,type(),The tuple() Constructor,Python Collections (Arrays)","Example,Example,Example,Example,Example,Example,Example,Example","Tuples are used to store multiple items in a single variable.,Tuple is one of 4 built-in data types in Python used to store collections of 
data, the other 3 are ,, 
,, and ,, all with different qualities and usage.,A tuple is a collection which is ordered and ,.,Tuples are written with round brackets.,Tuple items are ordered, unchangeable, and allow duplicate values.,Tuple items are indexed, the first item has index ,, the second item has index , etc.,When we say that tuples are ordered, it means that the items have a defined order, and that order will not change.,Tuples are unchangeable, meaning that we cannot change, add or remove items after the tuple has been created.,Since tuples are indexed, they can have items with the same value:,To determine how many items a tuple has, use the , function:,To create a tuple with only one item, you have to add a comma after the item, 
otherwise Python will not recognize it as a tuple.,Tuple items can be of any data type:,A tuple can contain different data types:,From Python's perspective, tuples are defined as objects with the data type 'tuple':,It is also possible to use the , constructor to make a tuple.,There are four collection data types in the Python programming language:,When choosing a collection type, it is useful to understand the properties of that type. Choosing the right type for a particular data set could mean retention of meaning, and, it could mean an increase in efficiency or security."," is a collection which is ordered and changeable. Allows duplicate members., is a collection which is ordered and unchangeable. Allows duplicate members., is a collection which is unordered, 
unchangeable*, and unindexed. No duplicate members., is a collection which is ordered** 
and changeable. No duplicate members.",,
Python ,Lists,"List,List Items,Ordered,Changeable,Allow Duplicates,List Length,List Items - Data Types,type(),The list() Constructor,Python Collections (Arrays)","Example,Example,Example,Example,Example,Example,Example","Lists are used to store multiple items in a single variable.,Lists are one of 4 built-in data types in Python used to store collections of 
data, the other 3 are ,, 
,, and ,, all with different qualities and usage.,Lists are created using square brackets:,List items are ordered, changeable, and allow duplicate values.,List items are indexed, the first item has index ,,
the second item has index , etc.,When we say that lists are ordered, it means that the items have a defined order, and that order will not change.,If you add new items to a list,
the new items will be placed at the end of the list.,The list is changeable, meaning that we can change, add, and remove items in a list after it has been created.,Since lists are indexed, lists can have items with the same value:,To determine how many items a list has, use the , function:,List items can be of any data type:,A list can contain different data types:,From Python's perspective, lists are defined as objects with the data type 'list':,It is also possible to use the , constructor when creating a 
new list.,There are four collection data types in the Python programming language:,When choosing a collection type, it is useful to understand the properties of that type. Choosing the right type for a particular data set could mean retention of meaning, and, it could mean an increase in efficiency or security."," is a collection which is ordered and changeable. Allows duplicate members., is a collection which is ordered and unchangeable. Allows duplicate members., is a collection which is unordered, 
unchangeable*, and unindexed. No duplicate members., is a collection which is ordered** 
and changeable. No duplicate members.",,
Pandas ,Exercises,"Exercises,Count Your Score",,"You can test your Pandas skills with W3Schools' Exercises.,We have gathered a variety of Pandas exercises (with answers) for each Pandas Chapter.,Try to solve an exercise by filling in the missing parts of a code. If you're stuck, hit the ""Show Answer"" button to see what you've done wrong.,You will get 1 point for
each correct answer. Your score and total score will always be displayed.",,,
Pandas - ,DataFrame Reference,,,"All properties and methods of the DataFrame object, with explanations and 
examples:",,,
Python ,Operators,"Python Operators,Python Arithmetic Operators,Python Assignment Operators,Python Comparison Operators,Python Logical Operators,Python Identity Operators,Python Membership Operators,Python Bitwise Operators",Example,"Operators are used to perform operations on variables and values.,In the example below, we use the , operator to add together two values:,Python divides the operators in the following groups:,Arithmetic operators are used with numeric values to perform common mathematical operations:,Assignment operators are used to assign values to variables:,Comparison operators are used to compare two values:,Logical operators are used to combine conditional statements:,Identity operators are used to compare the objects, not if they are equal, but if they are actually the same object, with the same memory location:,Membership operators are used to test if a sequence is presented in an object:,Bitwise operators are used to compare (binary) numbers:","Arithmetic operators,Assignment operators,Comparison operators,Logical operators,Identity operators,Membership operators,Bitwise operators",,
NumPy Logs,,"Logs,Log at Base 2,Log at Base 10,Natural Log, or Log at Base e,Log at Any Base","Example,Example,Example,Example","NumPy provides functions to perform log at the base 2, e and 10.,We will also explore how we can take log for any base by creating a custom ufunc.,All of the log functions will place -inf or inf in the elements if the log can not be computed.,Use the , function to perform log at the base 2.,Use the , function to perform log at the base 10.,Use the , function to perform log at the base e.,NumPy does not provide any function to take log at any base,
so we can use the , function along with inbuilt function , with two input parameters and one output parameter:",,,
