H1_leftside_heading,H1_rightside_heading,H2,H3,All_para,li,div,div_2
NumPy ,Array Iterating,"Iterating Arrays,Iterating 2-D Arrays,Iterating 3-D Arrays,Iterating Arrays Using nditer(),Iterating Array With Different Data Types,Iterating With Different Step Size, Enumerated Iteration Using ndenumerate()","Example,Example,Example,Example,Example,Example,Example,Example,Example,Example","Iterating means going through elements one by one.,As we deal with multi-dimensional arrays in numpy, we can do this using basic 
, loop of python.,If we iterate on a 1-D array it will go through each element one by one.,In a 2-D array it will go through all the rows.,To return the actual values, the scalars, we have to iterate the arrays in each dimension.,In a 3-D array it will go through all the 2-D arrays.,To return the actual values, the scalars, we have to iterate the arrays in each dimension.,The function , is a helping function that can be used from very basic to very advanced iterations. 
It solves some basic issues which we face in iteration, lets go through it with examples.

,In basic , loops, iterating through each scalar of an array we need to use 
, 
, loops which can be difficult to write for arrays with very high dimensionality.,We can use , argument and pass it the expected datatype to change the datatype of elements while iterating.,NumPy does not change the data type of the element in-place (where the element is in array) so it needs some other space to perform this action, that extra space is called buffer, and in order to enable it in , we pass ,.,We can use filtering and followed by iteration.,Enumeration means mentioning sequence number of somethings one by one.,Sometimes we require corresponding index of the element while iterating, the , method can be used for those usecases.",,,
NumPy ,Array Reshaping,"Reshaping arrays,Reshape From 1-D to 2-D,Reshape From 1-D to 3-D,Can We Reshape Into any Shape?,Returns Copy or View?,Unknown Dimension,Flattening the arrays","Example,Example,Example,Example,Example","Reshaping means changing the shape of an array.,The shape of an array is the number of elements in each dimension.,By reshaping we can add or remove dimensions or change number of elements in each dimension.,Yes, as long as the elements required for reshaping are equal in both shapes.,We can reshape an 8 elements 1D array into 4 elements in 2 rows 2D array but we cannot reshape it 
into a 3 elements 3 rows 2D array as that would require 3x3 = 9 elements.,The example above returns the original array, so it is a view.,You are allowed to have one ""unknown"" dimension.,Meaning that you do not have to specify an exact number for one of the 
dimensions in the reshape method.,Pass , as the value, and NumPy will 
calculate this number for you.,Flattening array means converting a multidimensional array into a 1D array.,We can use , to do this.",,,
NumPy ,Array Shape,"Shape of an Array,Get the Shape of an Array,What does the shape tuple represent?","Example,Example","The shape of an array is the number of elements in each dimension.,NumPy arrays have an attribute called , that returns a tuple with each index having the number of corresponding elements.,The example above returns ,, which means that the array has 2 dimensions, 
where the first dimension has 2 elements and the second has 4.,Integers at every index tells about the number of elements the corresponding dimension has.,In the example above at index-4 we have value 4, so we can say that 5th ( 4 + 1 th) dimension has 4 elements.",,,
NumPy ,Array Copy vs View,"The Difference Between Copy and View,COPY:,VIEW:,Check if Array Owns it's Data","Example,Example,Example,Example","The main difference between a copy and a view of an array is that
the copy is a new array, and the view is just a view of the original array.,The copy , the data and any changes made to the copy will not 
affect original array, and any changes made to the original array will not 
affect the copy.,The view , the data and any changes made to the view will 
affect the original array, and any changes made to the original array will 
affect the view.,As mentioned above, copies , the data, and views , 
the data, but how can we check this?,Every NumPy array has the attribute , that 
returns , if the array owns the data.,Otherwise, the ,  attribute refers to the original object.

",,,
NumPy ,Data Types,"Data Types in Python,Data Types in NumPy,Checking the Data Type of an Array,Creating Arrays With a Defined Data Type,What if a Value Can Not Be Converted?,Converting Data Type on Existing Arrays","Example,Example,Example,Example,Example,Example,Example","By default Python have these data types:,NumPy has some extra data types, and refer to data types with one 
character, like , for integers, , for unsigned integers etc.,Below is a list of all data types in NumPy and the characters used to represent them.,The NumPy array object has a property called , 
that returns the data type of the array:,We use the , function to create arrays, this function can take an optional argument: , 
that allows us to define the expected data type of the array elements:,For ,, ,, ,, 
, and , we can define size as well.,If a type is given in which elements can't be casted then NumPy will raise a ValueError.,The best way to change the data type of an existing array, is to make a copy 
of the array with the , method.,The , function creates a copy of the 
array, and allows you to specify the data type as a parameter.,The data type can be specified using a string, like , for float,
, for integer etc. or you can use the data type directly like
, for float and , for integer."," - used to represent text data, the text is given under quote marks. e.g. ""ABCD"", - used to represent integer numbers. e.g. -1, -2, -3, - used to represent real numbers. e.g. 1.2, 42.42, - used to represent True or False., - used to represent complex 
numbers. e.g. 1.0 + 2.0j, 1.5 + 2.5j, - integer, - boolean, - unsigned integer, - float, - complex float, - timedelta, - datetime, - object, - string, - unicode string, - fixed chunk of memory for other type ( void )",,
NumPy ,Array Slicing,"Slicing arrays,Negative Slicing,STEP,Slicing 2-D Arrays","Example,Example,Example,Example,Example,Example,Example,Example,Example","Slicing in python means taking elements from one given index to another given 
index.,We pass slice instead of index like this: ,.,We can also define the step, like this: ,.,If we don't pass start its considered 0,If we don't pass end its considered length of array in that dimension,If we don't pass step its considered 1,Use the minus operator to refer to an index from the end:,Use the , value to determine the step of the slicing:",,,
NumPy ,Array Indexing,"Access Array Elements,Access 2-D Arrays,Access 3-D Arrays,Negative Indexing","Example,Example,Example,Example,Example,Example,Example","Array indexing is the same as accessing an array element.,You can access an array element by referring to its index number.,The indexes in NumPy arrays start with 0, meaning that the first element  
has index 0, and the second has index 1 etc.,To access elements from 2-D arrays we can use comma separated integers representing 
the 
dimension and the index of the element.,Think of 2-D arrays like a table with rows and columns, where the row 
represents the dimension and the index represents the column.,To access elements from 3-D arrays we can use comma separated integers representing 
the dimensions and the index of the element., prints the value ,.,And this is why:,The first number represents the first dimension, which contains two arrays:,
[[1, 2, 3], [4, 5, 6]],
and:,
[[7, 8, 9], [10, 11, 12]],
Since we selected ,, we are left with the first array:,
[[1, 2, 3], [4, 5, 6]],The second number represents the second dimension, which also contains two arrays:,
[1, 2, 3],
and:,
[4, 5, 6],
Since we selected ,, we are left with the second array:,
[4, 5, 6],The third number represents the third dimension, which contains three values:,
4,
5,
6,
Since we selected ,, we end up with the third value:,
6,Use negative indexing to access an array from the end.",,,
NumPy ,Creating Arrays,"Create a NumPy ndarray Object,Dimensions in Arrays,0-D Arrays,1-D Arrays,2-D Arrays,3-D arrays,Check Number of Dimensions?,Higher Dimensional Arrays","Example,Example,Example,Example,Example,Example,Example,Example","NumPy is used to work with arrays. The array object in NumPy is called
,.,We can create a NumPy
, object by using the , function.,To create an ,,
we can pass a list, tuple or any array-like object into the , 
method, and it will be converted into an
,:,A dimension in arrays is one level of array depth (nested arrays).,0-D arrays, 
or Scalars, are the elements in an array. Each value in an array is a 0-D array.,An array that has 0-D arrays as its elements is called uni-dimensional or 1-D array.,These are the most common and basic arrays.,An array that has 1-D arrays as its elements is called a 2-D array.,These are often used to represent matrix or 2nd order tensors.,An array that has 2-D arrays (matrices) as its elements is called 3-D array.,These are often used to represent a 3rd order tensor.,NumPy Arrays provides the , attribute that returns an integer that tells us how many dimensions the array have.,An array can have any number of dimensions.,When the array is created, you can define the number of dimensions by using 
the , argument.,In this array the innermost dimension (5th dim) has 4 elements,
the 4th dim has 1 element that is the vector,
the 3rd dim has 1 element that is the matrix with the vector,
the 2nd dim has 1 element that is 3D array and 1st dim has 1 element that is a 4D array.",,,
NumPy ,Getting Started,"Installation of NumPy,Import NumPy,NumPy as np,Checking NumPy Version","Example,Example,Example","If you have , and , already installed on a system, then installation of 
NumPy is very easy.,Install it using this command:,If this command fails, then use a python distribution that already has NumPy installed like, Anaconda, Spyder etc.,Once NumPy is installed, import it in your applications by adding the
, keyword:,Now NumPy is imported and ready to use.,NumPy is usually imported under the , 
alias.,Create an alias with the , keyword while importing:,Now the NumPy package can be referred to as , instead of ,.,The version string is stored under , 
attribute.",,,
NumPy ,Introduction,"What is NumPy?,Why Use NumPy?,Why is NumPy Faster Than Lists?,Which Language is NumPy written in?,Where is the NumPy Codebase?",,"NumPy is a Python library used for working with arrays.,It also has functions for working in domain of linear algebra, fourier transform, and matrices.,NumPy was created in 2005 by Travis Oliphant. It is an open source project 
and you can use it freely.,NumPy stands for Numerical Python.,In Python we have lists that serve the purpose of arrays, but they are slow to process.,NumPy aims to provide an array object that is up to 50x faster than 
traditional Python lists.,The array object in NumPy is called ,, 
it provides a lot of supporting functions that make working with 
, very easy.,Arrays are very frequently used in data science, where speed and resources 
are very important.,NumPy arrays are stored at one continuous place in memory unlike lists, so processes can access and manipulate them very efficiently.,This behavior is called locality of reference in computer science.,This is the main reason why NumPy is faster than lists. Also it is optimized to work with latest CPU architectures.,NumPy is a Python library and is written partially in Python, but most of the parts that require fast computation are written in C or C++.,The source code for NumPy is located at this github repository 
",,,
