H1_leftside_heading,H1_rightside_heading,H2,H3,All_para,li,div,div_2
D3.js,,"How to Use D3.js?,Scatter Plot",Example,"To use D3.js in your web page, , to the library:,D3.js is easy to use.,This script selects the body element and appends a paragraph with the text ""Hello World!"":",,"
<script src=""//d3js.org/d3.v3.min.js""></script>
",
Google Chart,,"How to Use Google Chart?,Line Graph,Scatter Plots,Bar Charts,Pie Charts,3D Pie","Source Code,Source Code","To use Google Chart in your web page, , to the charts loader:,Google Chart is easy to use.,Just add a , element to display the chart:,The <div> element must have a unique id.,Then load the Google Graph API:,That's all!,To , the same data, change google.visualization to LineChart:,To convert a , Chart to a , chart, just replace:,
google.visualization.,with:,
google.visualization.,To display the Pie in 3D, just add , to the options:","Scatter Chart,Line Chart ,Bar / Column Chart,Area Chart,Pie Chart,Donut Chart,Org Chart,Map / Geo Chart","
<script,
src=""https://www.gstatic.com/charts/loader.js"">,
</script>
,
<div id=""myChart"" style=""max-width:700px; height:400px""></div>
",
JavaScript Graphics,,"Plotly.js,Chart.js,Google Chart",,"Plotly.js is a charting library that comes with over 40 chart types, 3D charts, statistical graphs, and SVG maps.,

,Chart.js comes with many built-in chart types:,


,From simple line charts to complex tree maps,
Google Chart provides a number of built-in chart types:,
,

","Plotly.js,Chart.js,Google Chart,Scatter,Line,Bar,Radar,Pie and Doughnut,Polar Area,Bubble,Scatter Chart,Line Chart ,Bar / Column Chart,Area Chart,Pie Chart,Donut Chart,Org Chart,Map / Geo Chart",,
Chart.js,,"How to Use Chart.js?,Scatter Plots,Line Graphs,Multiple Lines,Linear Graphs,Function Graphs,Bar Charts,Pie Charts,Doughnut Charts","Source Code,Source Code,Source Code,Source Code,Source Code,Horizontal Bars,Example","Chart.js is easy to use.,, add a link to the providing CDN (Content Delivery Network):,, add a <canvas> to where you want to draw the chart:,The canvas element must have a unique id.,That's all!,If you set the borderColor to zero, you can , the line graph:","Scatter,Line,Bar,Radar,Pie and Doughnut,Polar Area,Bubble","
<script,
src=""https://cdnjs.cloudflare.com/ajax/libs/Chart.js/2.9.4/Chart.js"">,
</script>
,
<canvas id=""myChart"" style=""width:100%;max-width:700px""></canvas>
",
Plotly.js,,"Scatter Plots,Line Graphs,Linear Graphs,Multiple Lines,Bar Charts,Horizontal Bar Charts,Pie Charts,Donut Charts,Plotting Equations","Source Code,Source Code,Source Code,Source Code,Source Code,Source Code,Source Code","To display a pie instead of bars, change x and y to labels and values, and change the type to ""pie"":,To display a donut instead of a pie, add a hole:",,,
HTML Canvas,,"Scatter Plots,Line Graphs,Combined","Source Code,Source Code,Source Code",,,,
Example 2 Training,,"Training Function,Test the Model","Un Normalize,Plot the Result"," defines how many iterations (loops) the model will do., is the function that runs the loops., defines the callback function to call
when the model wants to redraw the graphics.,When a model is trained, it is important to test and evaluate it.,We do this by inspecting what the model predicts for a range of different inputs.,But, before we can do that, we have to un-normalize the data:
,Then we can look at the result:",,,
Example 2 Model,,"Shuffle Data,TensorFlow Tensors,Data Normalization,Tensorflow Model,Compiling a Model",Example,"When a model is trained, the data is divided into small sets (batches).
Each batch is then fed to the model.
Shuffling is important to prevent the model getting the same data over again.
If using the same data twice, the model will not be able to generalize the data
and give the right output. Shuffling gives a better variety of data in each batch.,To use TensorFlow, input data needs to be converted to tensor data:,Data should be normalized before being used in a neural network.,A range of 0 - 1 using min-max are often best for numerical data:,A , is an algorithm that produces output from input.,This example uses 3 lines to define a ,:,
creates a ,.,In a sequential model, the input flows directly to the output. 
Other models can have multiple inputs and multiple outputs.
Sequential is the easiest ML model.
It allows you to build a model layer by layer,
with weights that correspond to the next layer., is used to add two layers to the model., is a layer type that works in most cases.
It multiplies its inputs by a weight-matrix and adds a number (bias) to the result., because we have 1 input (x = rooms).
, defines the size of the weight matrix:
1 weight for each input (x value).
,Compile the model with a specified , and , function:,The compiler is set to use the , optimizer.
It is simple to use and quite effective.,
is the function we want to use to compare model predictions and true values.",,,
Example 2 Data,,"Data Collection,Cleaning Data,Remove Data,Remove Errors,Fetching Data,Plotting the Data",,"The data used in Example 2, is a list of house objects:,The dataset is a JSON file stored at:,When preparing for machine learning, it is always important to:,A smart way to remove unnecessary data, it to extract ,.,This can be done by iterating (looping over) your data with a ,.,The function below takes an object and returns , from the object's
Horsepower and Miles_per_Gallon properties:,Most datasets contain some type of errors.,A smart way to remove errors is to use a , to filter out the errors.,The code below returns false if on of the properties (x or y) contains a null value:,When you have your map and filter functions ready, you can write a function to fetch the data.,
,Here is some code you can use to plot the data:","Remove the data you don't need,Clean the data from errors",,
TensorFlow Example 2,,"Input Data,Reduce Loss,Explained,Graphics (tfjs-vis)",,"The model above performs 4 important steps:,In the next chapters you will learn how to program a copy of the above example.,You will learn how to fetch data, clean data, and plot data.,You will also learn how to build a TensorFlow model, and how to train the model.,The graphics is diplayed using the ,.
,tfjs-vis is a small library for in browser visualization intended for use with TensorFlow.js.","It Collects Data,It Prepares Data,It Trains a Model,It Evaluates the Model,Graphic tools for visualizing ,Functions for visualizing , Objects,Visualizations can be organized in a , (a modal browser window),Can be used with , likes d3, Chart.js, and Plotly.js",,
Example 1 Training,,"Training Function,Test the Model","Un Normalize,Plot the Result"," defines how many iterations (loops) the model will do., is the function that runs the loops., defines the callback function to call
when the model wants to redraw the graphics.,When a model is trained, it is important to test and evaluate it.,We do this by inspecting what the model predicts for a range of different inputs.,But, before we can do that, we have to un-normalize the data:
,Then we can look at the result:",,,
Example 1 Model,,"Shuffle Data,TensorFlow Tensors,Data Normalization,Tensorflow Model,Compiling a Model",Example,"When a model is trained, the data is divided into small sets (batches).
Each batch is then fed to the model.
Shuffling is important to prevent the model getting the same data over again.
If using the same data twice, the model will not be able to generalize the data
and give the right output. Shuffling gives a better variety of data in each batch.,To use TensorFlow, input data needs to be converted to tensor data:,Data should be normalized before being used in a neural network.,A range of 0 - 1 using min-max are often best for numerical data:,A , is an algorithm that produces output from input.,This example uses 3 lines to define a ,:,
creates a ,.,In a sequential model, the input flows directly to the output. 
Other models can have multiple inputs and multiple outputs.
Sequential is the easiest ML model.
It allows you to build a model layer by layer,
with weights that correspond to the next layer., is used to add two layers to the model., is a layer type that works in most cases.
It multiplies its inputs by a weight-matrix and adds a number (bias) to the result., because we have 1 input (x = horsepower).
, defines the size of the weight matrix:
1 weight for each input (x value).
,Compile the model with a specified , and , function:,The compiler is set to use the , optimizer.
It is simple to use and quite effective.,
is the function we want to use to compare model predictions and true values.",,,
Example 1 Data,,"TensorFlow Data Collection,Cleaning Data,Remove Data,Remove Errors,Fetching Data,Plotting the Data",,"The data used in Example 1, is a list of car objects like this:,The dataset is a JSON file stored at:,When preparing for machine learning, it is always important to:,A smart way to remove unnecessary data, it to extract ,.,This can be done by iterating (looping over) your data with a ,.,The function below takes an object and returns , from the object's
Horsepower and Miles_per_Gallon properties:,Most datasets contain some type of errors.,A smart way to remove errors is to use a , to filter out the errors.,The code below returns false if on of the properties (x or y) contains a null value:,When you have your map and filter functions ready, you can write a function to fetch the data.,
,Here is some code you can use to plot the data:","Remove the data you don't need,Clean the data from errors",,
TensorFlow Example 1,,"Input Data,Reduce Loss,Explained,Graphics (tfjs-vis)",,"The model above performs 4 important steps:,In the next chapters you will learn how to program a copy of the above example.,You will learn how to fetch data, clean data, and plot data.,You will also learn how to build a TensorFlow model, and how to train the model.,The graphics is diplayed using the ,.
,tfjs-vis is a small library for in browser visualization intended for use with TensorFlow.js.","It Collects Data,It Prepares Data,It Trains a Model,It Evaluates the Model,Graphic tools for visualizing ,Functions for visualizing , Objects,Visualizations can be organized in a , (a modal browser window),Can be used with , likes d3, Chart.js, and Plotly.js",,
TensorFlow.js Visor,,"Using tfjs-vis,Scatter Plots,Bar Graphs,Line Graphs","Example,Example,Example with a Visor,Example,Example with a Visor,Example,Example with a Visor","To use tfjs-vis, add the following script tag to your HTML file(s):,Visualizations can be organized in a Visor (a modal browser window):,Visualizations can be organized in a Visor (a modal browser window):,Visualizations can be organized in a Visor (a modal browser window):"," is a graphic tools for visualizing ,It contains functions for visualizing ,Visualizations can be organized in , (modal browser windows),Can be used with , likes d3, Chart.js, and Plotly.js,Often called ","
<script src=""https://cdn.jsdelivr.net/npm/@tensorflow/tfjs-vis""></script>
",
TensorFlow Models,,"Tensorflow Models,A Tensorflow Project,Example,Collecting Data,Creating a Model,Adding Layers,Compiling the Model,Tensorflow Optimizers,Training the Model,Using the Model",," and , are important building blocks in ,.,For different Machine Learning tasks you must combine different types of Layers
into a Model that can be trained with data to predict future values.,TensorFlow.js is supporting different types of , and different types of ,A TensorFlow , is a , with one or more ,.,A Tensorflow project has this typical workflow:,Suppose you knew a function that defined a strait line:,Then you could calculate any y value with the JavaScript formula:,To demonstrate Tensorflow.js, we could train a Tensorflow.js model to
predict Y values based on X inputs.,Create a tensor (xs) with 5 x values:,Create a tensor (ys) with 5 correct y answers (multiply xs with 1.2 and add 5):,Create a sequential mode:.,Add one dense layer to the model.,The layer is only one unit (tensor) and the shape is 1 (one dimentional):,Compile the model using meanSquaredError as loss function and
sgd (stochastic gradient descent) as optimizer function:,Train the model (using xs and ys) with 500 repeats (epochs):,After the model is trained, you can use it for many different purposes.,This example predicts 10 y values, given 10 x values, and calls a function to plot the predictions in a graph:,This example predicts 10 y values, given 10 x values, and calls a function to display the values:","Collecting Data,Creating a Model,Adding Layers to the Model,Compiling the Model,Training the Model,Using the Model,Adadelta -Implements the Adadelta algorithm.,Adagrad - Implements the Adagrad algorithm.,Adam - Implements the Adam algorithm.,Adamax - Implements the Adamax algorithm.,Ftrl - Implements the FTRL algorithm.,Nadam - Implements the NAdam algorithm.,Optimizer - Base class for Keras optimizers.,RMSprop - Implements the RMSprop algorithm.,SGD - Stochastic Gradient Descent Optimizer.",,
TensorFlow Operations,,"Tensor Addition,Tensor Subtraction,Tensor Multiplication,Tensor Division,Tensor Square,Tensor Reshape","Example,Example,Example,Example,Example,Example","You can add two tensors using ,:,You can subtract two tensors using ,:,You can multiply two tensors using ,:,You can divide two tensors using ,:,You can square a tensor using ,:,The number of elements in a tensor is the product of the sizes in the shape.,Since there can be different shapes with the same size,
it is often useful to reshape a tensor to other shapes with the same size.,You can reshape a tensor using ,:","Add,Subtract,Multiply,Divide,Square,Reshape",,
TensorFlow.js Tutorial,,"Using TensorFlow,Tensors,Creating a Tensor,Tensor Shape,Tensor Data Types,Retrieve Tensor Values","Example,Example 2,Example 1,Example 2,Example1,Example2,Example3,Example,Example,Example","To use TensorFlow.js, add the following script tag to your HTML file(s):,To make sure you always use the latest version, use this:, is a , library 
to define and operate on ,.,A Tensor is much the same as a multidimensional array.,A Tensor contains numeric values in a (one or more) dimensional shape.,A Tensor has the following main properties:,A Tensor can be created from any ,:
,A Tensor can also be created from an , and a , parameter:
,A Tensor can have the following data types:
,When you create a tensor, you can specify the data type as the third parameter:,You can get the data behind a tensor using ,:,You can get the array behind a tensor using ,:","bool,int32,float32 (default),complex64,string","
<script src=""https://cdn.jsdelivr.net/npm/@tensorflow/tfjs@3.6.0/dist/tf.min.js""></script>
,
<script src=""https://cdn.jsdelivr.net/npm/@tensorflow/tfjs""></script>
",
Brain.js,,"Building a Neural Network,How to Predict a Contrast","Example:,Example,Example:","Building a neural network with Brain.js:,A Neural Network is created with: ,The network is trained with ,The examples represent 4 input values with a corresponding output value.,With ,, you ask ""What is the likely output of [1,0]?"",The answer from the network is:,With CSS, colors can be set by RGB:,The example below demonstrates how to predict the darkness of a color:,A Neural Network is created with: ,The network is trained with ,The examples represent 4 input values a corresponding output value.,With ,, you ask ""What is the likely output of dark blue?"",The answer from the network is:
,Why not edit the example to test the likely output of yellow or red?","one: 93% (close to 1),zero: 6% (close to 0),Dark: 95%,Light: 4% ",,
ML Terminology,,"Relationships,Machine Learning Labels,Machine Learning Features,Machine Learning Models,Machine Learning Training,Machine Learning Inference",,"Machine learning systems uses , between , to produce ,.,In algebra, a relationship is often written as ,:,With ML, a relationship is written as ,:,In Machine Learning terminology, the , is the thing we want to ,.,It is like the , in a linear graph:,In Machine Learning terminology, the , are the ,.,They are like the , values in a linear graph:,Sometimes there can be many features (input values) with different weights:,y = b + w, + w,
+ w, + w,A , defines the relationship between the label (y) and the 
features (x).
,There are three phases in the life of a model:,The goal of training is to create a model that can answer a question. Like 
what is the expected price for a house?,Inference is when the trained model is used to infer (predict) values using 
live data. Like putting the model into production.","Relationships,Labels,Features,Models,Training,Inference, is the label we want to predict, is the slope of the line, are the input values, is the intercept, is the label we want to predict, is the weight (the slope), are the features (input values), is the intercept,Data Collection,Training,Inference,
",,
Machine Learning,,"Gradient Descent,A Trainer Object,Cost Function,The Train Function,An Update Weights Function,Create Your Own Library",Library Code,"Train me to find the line of best fit:,
,
,
,
,
, is a popular algorithm for solving AI problems.,A simple , can be used to demonstrate a gradient descent.,The goal of a linear regression is to fit a linear graph to a set of (x,y) points.
This can be solved with a math formula. But a , can also solve this.,This is what the example above does.,It starts with a scatter plot and a linear model (y = wx + b).,Then it trains the model to find a line that fits the plot.
This is done by altering the weight (slope) and the bias (intercept) of the line.,Below is the code for a , that can solve this problem
(and many other problems).,Create a Trainer object that can take any number of (x,y) values in two arrays (xArr,yArr).,Set both weight and bias to zero.,A learning constant (learnc) has to be set, and a cost variable must be defined:,A standard way to solve a regression problem, is with an ""Cost Function"" that measures how good the solution is.,The function uses the weight and bias from the model (y = wx + b) and returns an error,
based on how well the line fits a plot.,The way to compute this error, is to loop through all (x,y) points in the plot,
and sum the square distances between the y value of each point and the line.,The most conventional way is to square the distances (to ensure positive values)
and to make the error function differentiable.,We will now run a gradient descent.,The gradient descent algorithm should walk the cost function towards the best line.,Each iteration should update both m and b towards a line with a lower cost (error).,To do that, we add a train function that loops over all the data many times:,The train function above should update the weights and biases in each iteration.,The direction to move is calculated using two partial derivatives:"," is the error (cost), is the total number of observations (points), is the value (label) of each observation, is the value (feature) of each observation, is the slope (weight), is intercept (bias), is the prediction, is the squared mean value","
<script src=""myailib.js""></script>
",
Testing a Perceptron,,"Test Your Library,Count the Errors,Tune the Perceptron","Example,Example","Generate new unknown points and check if your Perceptron can guess the right answers:,Add a counter to count the number of errors:,How can you tune the Perceptron?,Here are some suggestions:","A Perceptron must be , and ,A Perceptron must be tested against ,.,Adjust the learning rate,Increase the number of training data,Increase the number of training iterations",,
Training a Perceptron,,"Training Task,Create a Perceptron Object,Add an Activate Function,Create a Training Function,Backpropagation,Create Your Own Library,Use Your Library","Example,Example,Example,Library Code,Example","Imagine a straight line in a space with scattered x y points.,Train a perceptron to classify the points over and under the line.,Create a Perceptron object. Name it anything (like Perceptron).,Let the perceptron accept two parameters:
,Set the default learning rate to 0.00001.,Then create random weights between -1 and 1 for each input.,Remember the perceptron algorithm:,The activation function will output:,The training function guesses the outcome based on the activate function.,Every time the guess is wrong, the perceptron should adjust the weights.,After many guesses and adjustments, the weights will be correct.,After each guess, the perceptron calculates how wrong the guess was.,If the guess is wrong, the perceptron adjusts the bias and the weights
so that the guess will be a little bit more correct the next time.,This type of learning is called ,.
,After trying (a few thousand times) your perceptron will become quite good at guessing.","Create a ,Create a , the perceptron against the desired answers,Multiply each input with the perceptron's weights,Sum the results,Compute the outcome,1 if the sum is greater than 0,0 if the sum is less than 0","
<script src=""myperceptron.js""></script>
",
Pattern Recognition,,"Pattern Classification,How to Program a Perceptron,Create a Simple Plotter,Create Random X Y Points,Create a Line Function,Compute Desired Answers,Display the Desired Answers,How to Train a Perceptron","Example,Example,Example,Example,Example","Imagine a strait line (a linear graph) in a space with scattered x y points.,How can you classify the points over and under the line?,A perceptron can be trained to recognize the points over the line,
without knowing the formula for the line.,To learn more about how to program a perceptron, we will create a very simple JavaScript program
that will:,Use the simple plotter object described in the ,.,Create as many xy points as wanted.,Let the x values be random, between 0 and maximum.,Let the y values be random, between 0 and maximum.,Display the points in the plotter:,Display the line in the plotter:,Compute the desired answers based on the line function:,y = x * 1.2 + 50.,The desired answer is 1 if y is over the line and 0 if y is under the line.,Store the desired answers in an array (desired[]).,For each point, if desired[i] = 1 display a blue point,
else display a black point.,In the next chapters, you will learn more about how to Train the Perceptron",,,
Vectors,,"Vector Notation,Vectors in Geometry,Motion,Vector Addition,Vector Subtraction,Scalar Operations,Force,Velocity",,"Vectors can be written in many ways. The most common are:,or:,Vectors are the building blocks of ,In geometry, a vector can describe a movement from one point to another.,The vector [3, 2] says go 3 right and 2 up.,The sum of two vectors (,) is found by moving the vector , until the tail meets the head of vector ,.
(This does not change vector b).,Then, the line from the tail of , to the head of , is the vector ,:,
,Vector , is the opposite of ,.,This means that vector a and vector -a has the same magnitude in opposite directions:,
,Vectors can be modified by adding, subtracting, or multiplying a scalar (number) from all the vector values:
,a = [1 1 1],a + 1 = [2 2 2],[1 2 3] + 1 = [2 3 4],Vector multiplications has much of the same properties as normal multiplication:,[2 2 2] * 3 = [6 6 6],[6 6 6] / 3 = [2 2 2], is a Vector.,Force is a vector with a , and a ,., is a Vector.,Velocity is a vector with a , and a ,.",,,
Linear Algebra,,"Vectors and Matrices,Scalars,Vectors,Matrices,Tensors",Example," and , are the languages of data.,With AI, most things are done with vectors and matrices.,With vectors and matrices, you can ,.,In linear algebra, a scalar is a ,.,In JavaScript it can be written like a constant or a variable:,In linear algebra, a vector is an ,.,In JavaScript, it can be written as an array:,An array can have multiple dimensions, but a vector is a ,.,A vector can be written in many ways. The most common are:,or:,In linear algebra, a matrix is a ,.,In JavaScript, a matrix is an array with 2 indices (indexes).,A Tensor is an ,.,In JavaScript, a matrix is an array with multiple indices (indexes).","AI make heavy use of ,AI make heavy use of ,AI make heavy use of ,AI make heavy use of ",,
Linear Functions,,"Linear Functions,Linear Equations,Non-Linear Equations,Linear Regression,Linear Least Squares",,"A , is special relationship where each input has an output.,A function is often written as , where x is the input:,Results from f(x) = x,Results from f(x) = 2x,A Linear Equation is an equation for a straight line:,A Linear Equation can NOT contain exponents or square roots:,A Linear regression tries to model the relationship between two variables by fitting a linear graph to data.,One variable (x) is considered to be data, and the other (y) is considered to be dependent.,For example, a Linear Regression can be a model to relate the price of houses to their size.,Linear algebra is used to solve Linear Equations.,Linear Least Squares (LLS) is a set of formulations for solving statistical problems
involved in Linear Regression.","Linear means ,A , is a ,A , represents a ,y = x,y = x*2,y = x*2 + 7,y = ax + b,5x = 3y,y/2 = 6,y = x**2,y = Math.sqrt(x),y = Math.sin(x)",,
